[
  {
    "bookmark_id": "d35e76b8307274c0",
    "display_date": "2026-08-10",
    "display_week": "2026-W33",
    "hash": "24192733e93d",
    "note": "",
    "tags": [
      "UNSORTED"
    ],
    "taxonomy_category": "UNSORTED",
    "taxonomy_subcategory": "UNSORTED",
    "title": "24. Group Linkages & Events",
    "url": "http://web.stanford.edu/group/mappingmilitants/cgi-bin/"
  },
  {
    "bookmark_id": "7364c19955d32404",
    "display_date": "2026-08-10",
    "display_week": "2026-W33",
    "hash": "13ecf5891bff",
    "note": "",
    "tags": [
      "INFSEC",
      "PENTEST",
      "WEB"
    ],
    "taxonomy_category": "INFSEC",
    "taxonomy_subcategory": "PENTEST",
    "title": "247CTF - The game never stops",
    "url": "https://247ctf.com/"
  },
  {
    "bookmark_id": "d09503eb409bfba0",
    "display_date": "2026-08-10",
    "display_week": "2026-W33",
    "hash": "da03ab19c74d",
    "note": "",
    "tags": [
      "UNSORTED"
    ],
    "taxonomy_category": "UNSORTED",
    "taxonomy_subcategory": "UNSORTED",
    "title": "25 Satellite Maps To See Earth in New Ways [2020] - GIS Geography - Pool of satellite imagery",
    "url": "https://gisgeography.com/satellite-maps/"
  },
  {
    "bookmark_id": "f77eadec33924bda",
    "display_date": "2026-08-10",
    "display_week": "2026-W33",
    "hash": "c470af7978ed",
    "note": "",
    "tags": [
      "UNSORTED"
    ],
    "taxonomy_category": "UNSORTED",
    "taxonomy_subcategory": "UNSORTED",
    "title": "3 Years Later: An Analysis of GDPR Enforcement | Center for Strategic and International Studies",
    "url": "https://www.csis.org/blogs/strategic-technologies-blog/3-years-later-analysis-gdpr-enforcement"
  },
  {
    "bookmark_id": "5fc0ebe4606f24c8",
    "display_date": "2026-08-10",
    "display_week": "2026-W33",
    "hash": "6381db2b1fc2",
    "note": "",
    "tags": [
      "ARPG",
      "GAMING"
    ],
    "taxonomy_category": "GAMING",
    "taxonomy_subcategory": "ARPG",
    "title": "3.23 MF builds/atlas - Google Drive",
    "url": "https://docs.google.com/spreadsheets/d/e/2PACX-1vR35NJkrhF1Zf9SZZOPlsdpqbTibL2AqOiZosya0NSjEN5A1Dx8a_MeQox9VDLQw3kB0ibZCNb_e6VJ/pubhtml#"
  },
  {
    "bookmark_id": "03f1624b07eadc3c",
    "display_date": "2026-08-10",
    "display_week": "2026-W33",
    "hash": "82839236b82a",
    "note": "",
    "tags": [
      "BALTIMORE",
      "RESEARCH"
    ],
    "taxonomy_category": "RESEARCH",
    "taxonomy_subcategory": "BALTIMORE",
    "title": "3.png (1011×772)",
    "url": "https://images.squarespace-cdn.com/content/v1/58b4b8216a49630b4301df9f/1570558760907-G656FQTTBO8QVLGFPT86/3.png?format=2500w"
  },
  {
    "bookmark_id": "b0c01f863f06ee9b",
    "display_date": "2026-08-10",
    "display_week": "2026-W33",
    "hash": "f5b0bcf5f0d4",
    "note": "",
    "tags": [
      "DEV",
      "GITHUB",
      "PYTHON"
    ],
    "taxonomy_category": "DEV",
    "taxonomy_subcategory": "PYTHON",
    "title": "37. ttk.Notebook",
    "url": "https://anzeljg.github.io/rin2/book2/2405/docs/tkinter/ttk-Notebook.html#ttk-Notebook-tab-options"
  },
  {
    "bookmark_id": "6b2edeb6d93215fb",
    "display_date": "2026-08-10",
    "display_week": "2026-W33",
    "hash": "e6c9f9707039",
    "note": "",
    "tags": [
      "UNSORTED"
    ],
    "taxonomy_category": "UNSORTED",
    "taxonomy_subcategory": "UNSORTED",
    "title": "411 - White Pages | Find Phone Numbers, People, Addresses & More",
    "url": "https://www.411.com/"
  },
  {
    "bookmark_id": "343b04ee44206667",
    "display_date": "2026-08-10",
    "display_week": "2026-W33",
    "hash": "d9450b624b21",
    "note": "",
    "tags": [
      "UNSORTED"
    ],
    "taxonomy_category": "UNSORTED",
    "taxonomy_subcategory": "UNSORTED",
    "title": "4chan - Archiveteam",
    "url": "https://wiki.archiveteam.org/index.php/4chan#The_Second_4archive.org"
  },
  {
    "bookmark_id": "8a7df19cd7ef4ea7",
    "display_date": "2026-08-10",
    "display_week": "2026-W33",
    "hash": "6a65bc60b6a0",
    "note": "",
    "tags": [
      "UNSORTED"
    ],
    "taxonomy_category": "UNSORTED",
    "taxonomy_subcategory": "UNSORTED",
    "title": "5Ghz Interference Tracker - Map Builder",
    "url": "https://orbtwz.users.earthengine.app/view/radarinterferencetracker"
  },
  {
    "bookmark_id": "135975580549d9e3",
    "display_date": "2026-08-10",
    "display_week": "2026-W33",
    "hash": "ad8159e7b44c",
    "note": "",
    "tags": [
      "BALTIMORE",
      "RESEARCH"
    ],
    "taxonomy_category": "RESEARCH",
    "taxonomy_subcategory": "BALTIMORE",
    "title": "5th Special Forces Group (United States) - Wikipedia",
    "url": "https://en.wikipedia.org/wiki/5th_Special_Forces_Group_(United_States)"
  },
  {
    "bookmark_id": "81a8382a4d19aa57",
    "display_date": "2026-08-10",
    "display_week": "2026-W33",
    "hash": "770cd6346519",
    "note": "",
    "tags": [
      "DEV",
      "WEBDEV"
    ],
    "taxonomy_category": "DEV",
    "taxonomy_subcategory": "WEBDEV",
    "title": "6.828 / Fall 2016",
    "url": "https://pdos.csail.mit.edu/6.828/2016/index.html"
  }
]
